{
  "competition": {
    "name": "Paris 2024 Olympic Games - Men's Football",
    "season": "2024",
    "round": "Group D"
  },
  "venue": {
    "name": "Bordeaux Stadium",
    "city": "Bordeaux"
  },
  "kickoff": "2024-07-27T21:00:00+02:00",
  "status": "FT",
  "teams": {
    "home": "Japan",
    "away": "Mali"
  },
  "score": {
    "home": 1,
    "away": 0,
    "halfTime": {
      "home": 0,
      "away": 0
    }
  },
  "scorers": [
    {
      "team": "Japan",
      "player": "Rihito Yamamoto",
      "minute": 82,
      "type": "open_play"
    }
  ],
  "lineups": {
    "home": {
      "team": "Japan",
      "formation": "4-1-2-3",
      "coach": "Go Oiwa",
      "startingXI": [
        { "name": "Leobrian Kokubo", "number": 1, "position": "GK" },
        { "name": "Ryuya Nishio", "number": 3, "position": "DF" },
        { "name": "Hiroki Sekine", "number": 4, "position": "DF" },
        { "name": "Rihito Yamamoto", "number": 7, "position": "MF" },
        { "name": "Joel Chima Fujita", "number": 8, "position": "MF" },
        { "name": "Koki Saito", "number": 10, "position": "FW" },
        { "name": "Mao Hosoya", "number": 11, "position": "FW" },
        { "name": "Ryotaro Araki", "number": 13, "position": "MF" },
        { "name": "Kota Takai", "number": 15, "position": "DF" },
        { "name": "Ayumu Ohata", "number": 16, "position": "DF" },
        { "name": "Fuki Yamada", "number": 20, "position": "MF" }
      ],
      "bench": [
        { "name": "Taishi Nozawa", "number": 12, "position": "GK" },
        { "name": "Seiji Kimura", "number": 5, "position": "DF" },
        { "name": "Sota Kawasaki", "number": 6, "position": "MF" },
        { "name": "Shota Fujio", "number": 9, "position": "FW" },
        { "name": "Shunsuke Mito", "number": 14, "position": "MF" },
        { "name": "Kein Sato", "number": 18, "position": "FW" },
        { "name": "Takashi Uchino", "number": 21, "position": "DF" }
      ]
    },
    "away": {
      "team": "Mali",
      "formation": "4-1-2-3",
      "coach": "Badara Alou Diallo",
      "startingXI": [
        { "name": "Lassine Diarra", "number": 1, "position": "GK" },
        { "name": "Fode Doucoure", "number": 2, "position": "DF" },
        { "name": "Mamadou Tounkara", "number": 4, "position": "DF" },
        { "name": "Ibrahima Cisse", "number": 5, "position": "DF" },
        { "name": "Boubacar Traore", "number": 8, "position": "MF" },
        { "name": "Cheickna Doumbia", "number": 9, "position": "FW" },
        { "name": "Salam Jiddou", "number": 10, "position": "MF" },
        { "name": "Thiemoko Diarra", "number": 11, "position": "FW" },
        { "name": "Brahima Diarra", "number": 13, "position": "MF" },
        { "name": "Ahmed Diomande", "number": 17, "position": "DF" },
        { "name": "Moussa Diakite", "number": 18, "position": "DF" }
      ],
      "bench": [
        { "name": "Oumar Coulibaly", "number": 16, "position": "GK" },
        { "name": "Hamidou Diallo", "number": 3, "position": "DF" },
        { "name": "Coli Saco", "number": 6, "position": "MF" },
        { "name": "Wilson Samake", "number": 7, "position": "FW" },
        { "name": "Issouf Sissokho", "number": 12, "position": "MF" },
        { "name": "Demba Diallo", "number": 14, "position": "FW" },
        { "name": "Mohamed Cisset", "number": 15, "position": "DF" }
      ]
    }
  }
}
