{
  "competition": {
    "name": "Paris 2024 Olympic Games - Men's Football",
    "season": "2024",
    "round": "Group D"
  },
  "venue": {
    "name": "Bordeaux Stadium",
    "city": "Bordeaux"
  },
  "kickoff": "2024-07-24T19:00:00+02:00",
  "status": "FT",
  "teams": {
    "home": "Japan",
    "away": "Paraguay"
  },
  "score": {
    "home": 5,
    "away": 0,
    "halfTime": {
      "home": 1,
      "away": 0
    }
  },
  "scorers": [
    {
      "team": "Japan",
      "player": "Shunsuke Mito",
      "minute": 19,
      "assist": "Ayumu Ohata",
      "type": "open_play"
    },
    {
      "team": "Japan",
      "player": "Shunsuke Mito",
      "minute": 63,
      "assist": "Koki Saito",
      "type": "open_play"
    },
    {
      "team": "Japan",
      "player": "Rihito Yamamoto",
      "minute": 69,
      "assist": "Koki Saito",
      "type": "open_play"
    },
    {
      "team": "Japan",
      "player": "Shota Fujio",
      "minute": 81,
      "type": "open_play"
    },
    {
      "team": "Japan",
      "player": "Shota Fujio",
      "minute": 87,
      "assist": "Mao Hosoya",
      "type": "open_play"
    }
  ],
  "lineups": {
    "home": {
      "team": "Japan",
      "formation": "4-2-3-1",
      "coach": "Go Oiwa",
      "startingXI": [
        { "name": "Leobrian Kokubo", "number": 1, "position": "GK" },
        { "name": "Hiroki Sekine", "number": 4, "position": "DF" },
        { "name": "Seiji Kimura", "number": 5, "position": "DF" },
        { "name": "Rihito Yamamoto", "number": 7, "position": "MF" },
        { "name": "Joel Chima Fujita", "number": 8, "position": "MF" },
        { "name": "Koki Saito", "number": 10, "position": "FW" },
        { "name": "Mao Hosoya", "number": 11, "position": "FW" },
        { "name": "Shunsuke Mito", "number": 14, "position": "MF" },
        { "name": "Kota Takai", "number": 15, "position": "DF" },
        { "name": "Ayumu Ohata", "number": 16, "position": "DF" },
        { "name": "Yu Hirakawa", "number": 17, "position": "FW" }
      ],
      "bench": [
        { "name": "Taishi Nozawa", "number": 12, "position": "GK" },
        { "name": "Kaito Suzuki", "number": 2, "position": "DF" },
        { "name": "Ryuya Nishio", "number": 3, "position": "DF" },
        { "name": "Sota Kawasaki", "number": 6, "position": "MF" },
        { "name": "Shota Fujio", "number": 9, "position": "FW" },
        { "name": "Ryotaro Araki", "number": 13, "position": "MF" },
        { "name": "Kein Sato", "number": 18, "position": "FW" }
      ]
    },
    "away": {
      "team": "Paraguay",
      "formation": "3-4-3",
      "coach": "Carlos Jara Saguier",
      "startingXI": [
        { "name": "Gatito Fernandez", "number": 1, "position": "GK" },
        { "name": "Ronaldo de Jesus", "number": 3, "position": "DF" },
        { "name": "Daniel Rivas", "number": 4, "position": "DF" },
        { "name": "Gilberto Flores", "number": 5, "position": "DF" },
        { "name": "Marcos Gomez", "number": 6, "position": "MF" },
        { "name": "Marcelo Fernandez", "number": 7, "position": "FW" },
        { "name": "Diego Gomez", "number": 8, "position": "MF" },
        { "name": "Wilder Viera", "number": 10, "position": "MF" },
        { "name": "Fabian Balbuena", "number": 14, "position": "DF" },
        { "name": "Julio Enciso", "number": 15, "position": "FW" },
        { "name": "Gustavo Caballero", "number": 17, "position": "FW" }
      ],
      "bench": [
        { "name": "Rodrigo Frutos", "number": 12, "position": "GK" },
        { "name": "Alan Nunez", "number": 2, "position": "DF" },
        { "name": "Kevin Parzajuk", "number": 9, "position": "FW" },
        { "name": "Enso Gonzalez", "number": 11, "position": "FW" },
        { "name": "Alexis Cantero", "number": 13, "position": "DF" },
        { "name": "Fernando Roman", "number": 16, "position": "DF" },
        { "name": "Marcelo Perez", "number": 18, "position": "FW" }
      ]
    }
  }
}
