{
  "competition": {
    "name": "Paris 2024 Olympic Games - Men's Football",
    "season": "2024",
    "round": "Group B"
  },
  "venue": {
    "name": "Nice Stadium",
    "city": "Nice"
  },
  "kickoff": "2024-07-30T17:00:00+02:00",
  "status": "FT",
  "teams": {
    "home": "Morocco",
    "away": "Iraq"
  },
  "score": {
    "home": 3,
    "away": 0,
    "halfTime": {
      "home": 3,
      "away": 0
    }
  },
  "scorers": [
    {
      "team": "Morocco",
      "player": "Amir Richardson",
      "minute": 19,
      "assist": "Achraf Hakimi",
      "type": "open_play"
    },
    {
      "team": "Morocco",
      "player": "Soufiane Rahimi",
      "minute": 28,
      "type": "open_play"
    },
    {
      "team": "Morocco",
      "player": "Abde Ezzalzouli",
      "minute": 36,
      "assist": "Zakaria El Ouahdi",
      "type": "open_play"
    }
  ],
  "lineups": {
    "home": {
      "team": "Morocco",
      "formation": "4-2-3-1",
      "coach": "Tarik Sektioui",
      "startingXI": [
        { "name": "Munir El Kajoui", "number": 1, "position": "GK" },
        { "name": "Achraf Hakimi", "number": 2, "position": "DF" },
        { "name": "Mehdi Boukamir", "number": 4, "position": "DF" },
        { "name": "Bilal El Khannouss", "number": 8, "position": "MF" },
        { "name": "Soufiane Rahimi", "number": 9, "position": "FW" },
        { "name": "Ilias Akhomach", "number": 10, "position": "FW" },
        { "name": "Zakaria El Ouahdi", "number": 11, "position": "DF" },
        { "name": "Oussama Targhalline", "number": 14, "position": "MF" },
        { "name": "Abde Ezzalzouli", "number": 16, "position": "FW" },
        { "name": "Oussama El Azzouzi", "number": 17, "position": "MF" },
        { "name": "Amir Richardson", "number": 18, "position": "MF" }
      ],
      "bench": [
        { "name": "Rachid Ghanimi", "number": 12, "position": "GK" },
        { "name": "Akram Nakach", "number": 3, "position": "DF" },
        { "name": "Adil Tahif", "number": 5, "position": "DF" },
        { "name": "Benjamin Bouchouari", "number": 6, "position": "MF" },
        { "name": "Eliesse Ben Seghir", "number": 7, "position": "FW" },
        { "name": "Yassine Kechta", "number": 13, "position": "MF" },
        { "name": "Mehdi Maouhoub", "number": 15, "position": "FW" }
      ]
    },
    "away": {
      "team": "Iraq",
      "formation": "4-2-3-1",
      "coach": "Radhi Shenaishil",
      "startingXI": [
        { "name": "Hussein Hasan", "number": 1, "position": "GK" },
        { "name": "Suad Natiq", "number": 4, "position": "DF" },
        { "name": "Ahmed Hasan", "number": 5, "position": "DF" },
        { "name": "Ibrahim Bayesh", "number": 8, "position": "MF" },
        { "name": "Youssef Amyn", "number": 10, "position": "MF" },
        { "name": "Muntadher Mohammed", "number": 11, "position": "MF" },
        { "name": "Karrar Saad", "number": 13, "position": "DF" },
        { "name": "Karrar Mohammed", "number": 14, "position": "MF" },
        { "name": "Mustafa Saadoon", "number": 17, "position": "DF" },
        { "name": "Aymen Hussein", "number": 18, "position": "FW" },
        { "name": "Hussein Amer", "number": 20, "position": "DF" }
      ],
      "bench": [
        { "name": "Kumel Saadi", "number": 12, "position": "GK" },
        { "name": "Josef Al Imam", "number": 2, "position": "DF" },
        { "name": "Hussein Ali", "number": 3, "position": "DF" },
        { "name": "Ali Jasim", "number": 7, "position": "MF" },
        { "name": "Hussein Lawend", "number": 9, "position": "FW" },
        { "name": "Nihad Mohammed", "number": 15, "position": "MF" },
        { "name": "Muntadher Abdulameer", "number": 16, "position": "MF" }
      ]
    }
  }
}
