{
  "competition": {
    "name": "Paris 2024 Olympic Games - Men's Football",
    "season": "2024",
    "round": "Group A"
  },
  "venue": {
    "name": "Marseille Stadium",
    "city": "Marseille"
  },
  "kickoff": "2024-07-30T19:00:00+02:00",
  "status": "FT",
  "teams": {
    "home": "New Zealand",
    "away": "France"
  },
  "score": {
    "home": 0,
    "away": 3,
    "halfTime": {
      "home": 0,
      "away": 1
    }
  },
  "scorers": [
    {
      "team": "France",
      "player": "Jean-Philippe Mateta",
      "minute": 19,
      "type": "open_play"
    },
    {
      "team": "France",
      "player": "Desire Doue",
      "minute": 71,
      "type": "open_play"
    },
    {
      "team": "France",
      "player": "Arnaud Kalimuendo",
      "minute": 74,
      "type": "open_play"
    }
  ],
  "lineups": {
    "home": {
      "team": "New Zealand",
      "formation": "4-2-3-1",
      "coach": "Darren Bazeley",
      "startingXI": [
        { "name": "Alex Paulsen", "number": 1, "position": "GK" },
        { "name": "Michael Boxall", "number": 2, "position": "DF" },
        { "name": "Sam Sutton", "number": 3, "position": "DF" },
        { "name": "Tyler Bindon", "number": 4, "position": "DF" },
        { "name": "Finn Surman", "number": 5, "position": "DF" },
        { "name": "Joe Bell", "number": 6, "position": "MF" },
        { "name": "Matthew Garbett", "number": 7, "position": "MF" },
        { "name": "Ben Waine", "number": 9, "position": "FW" },
        { "name": "Sarpreet Singh", "number": 10, "position": "MF" },
        { "name": "Lukas Kelly-Heald", "number": 13, "position": "DF" },
        { "name": "Oskar van Hattum", "number": 18, "position": "FW" }
      ],
      "bench": [
        { "name": "Kees Sims", "number": 12, "position": "GK" },
        { "name": "Jesse Randall", "number": 11, "position": "FW" },
        { "name": "Jay Herdman", "number": 14, "position": "FW" },
        { "name": "Matthew Sheridan", "number": 15, "position": "DF" },
        { "name": "Fin Conchie", "number": 16, "position": "MF" },
        { "name": "Lachlan Bayliss", "number": 17, "position": "MF" },
        { "name": "Liam Gillion", "number": 19, "position": "FW" }
      ]
    },
    "away": {
      "team": "France",
      "formation": "3-4-1-2",
      "coach": "Thierry Henry",
      "startingXI": [
        { "name": "Obed Nkambadio", "number": 1, "position": "GK" },
        { "name": "Castello Lukeba", "number": 2, "position": "DF" },
        { "name": "Arnaud Kalimuendo", "number": 9, "position": "FW" },
        { "name": "Desire Doue", "number": 11, "position": "MF" },
        { "name": "Jean-Philippe Mateta", "number": 14, "position": "FW" },
        { "name": "Bradley Locko", "number": 15, "position": "DF" },
        { "name": "Soungoutou Magassa", "number": 17, "position": "DF" },
        { "name": "Rayan Cherki", "number": 18, "position": "MF" },
        { "name": "Chrislain Matsima", "number": 19, "position": "DF" },
        { "name": "Andy Diouf", "number": 20, "position": "MF" },
        { "name": "Johann Lepenant", "number": 21, "position": "MF" }
      ],
      "bench": [
        { "name": "Guillaume Restes", "number": 16, "position": "GK" },
        { "name": "Adrien Truffert", "number": 3, "position": "DF" },
        { "name": "Loic Bade", "number": 4, "position": "DF" },
        { "name": "Michael Olise", "number": 7, "position": "FW" },
        { "name": "Maghnes Akliouche", "number": 8, "position": "MF" },
        { "name": "Alexandre Lacazette", "number": 10, "position": "FW" },
        { "name": "Joris Chotard", "number": 13, "position": "MF" }
      ]
    }
  }
}
