{
  "competition": {
    "name": "Paris 2024 Olympic Games - Men's Football",
    "season": "2024",
    "round": "Group B"
  },
  "venue": {
    "name": "Lyon Stadium",
    "city": "Lyon"
  },
  "kickoff": "2024-07-24T19:00:00+02:00",
  "status": "FT",
  "teams": {
    "home": "Iraq",
    "away": "Ukraine"
  },
  "score": {
    "home": 2,
    "away": 1,
    "halfTime": {
      "home": 0,
      "away": 0
    }
  },
  "scorers": [
    {
      "team": "Ukraine",
      "player": "Valentyn Rubchynskyi",
      "minute": 53,
      "type": "open_play"
    },
    {
      "team": "Iraq",
      "player": "Aymen Hussein",
      "minute": 56,
      "type": "penalty"
    },
    {
      "team": "Iraq",
      "player": "Ali Jasim",
      "minute": 75,
      "type": "open_play"
    }
  ],
  "lineups": {
    "home": {
      "team": "Iraq",
      "formation": "5-4-1",
      "coach": "Radhi Shenaishil",
      "startingXI": [
        { "name": "Hussein Hasan", "number": 1, "position": "GK" },
        { "name": "Hussein Ali", "number": 3, "position": "DF" },
        { "name": "Ahmed Hasan", "number": 5, "position": "DF" },
        { "name": "Zaid Tahseen", "number": 6, "position": "DF" },
        { "name": "Ibrahim Bayesh", "number": 8, "position": "MF" },
        { "name": "Youssef Amyn", "number": 10, "position": "MF" },
        { "name": "Muntadher Mohammed", "number": 11, "position": "MF" },
        { "name": "Karrar Mohammed", "number": 14, "position": "MF" },
        { "name": "Mustafa Saadoon", "number": 17, "position": "DF" },
        { "name": "Aymen Hussein", "number": 18, "position": "FW" },
        { "name": "Hussein Amer", "number": 20, "position": "DF" }
      ],
      "bench": [
        { "name": "Kumel Saadi", "number": 12, "position": "GK" },
        { "name": "Josef Al Imam", "number": 2, "position": "DF" },
        { "name": "Ali Jasim", "number": 7, "position": "MF" },
        { "name": "Hussein Lawend", "number": 9, "position": "FW" },
        { "name": "Karrar Saad", "number": 13, "position": "DF" },
        { "name": "Nihad Mohammed", "number": 15, "position": "MF" },
        { "name": "Muntadher Abdulameer", "number": 16, "position": "MF" }
      ]
    },
    "away": {
      "team": "Ukraine",
      "formation": "4-5-1",
      "coach": "Ruslan Rotan",
      "startingXI": [
        { "name": "Kiril Fesiun", "number": 12, "position": "GK" },
        { "name": "Illia Krupskyi", "number": 2, "position": "DF" },
        { "name": "Oleksandr Martyniuk", "number": 3, "position": "DF" },
        { "name": "Maksym Talovierov", "number": 4, "position": "DF" },
        { "name": "Valentyn Rubchynskyi", "number": 5, "position": "MF" },
        { "name": "Mykola Mykhailenko", "number": 8, "position": "MF" },
        { "name": "Maksym Braharu", "number": 10, "position": "MF" },
        { "name": "Maksym Khlan", "number": 11, "position": "MF" },
        { "name": "Danylo Sikan", "number": 14, "position": "FW" },
        { "name": "Arsenii Batahov", "number": 16, "position": "DF" },
        { "name": "Dmytro Kryskiv", "number": 18, "position": "MF" }
      ],
      "bench": [
        { "name": "Georgiy Yermakov", "number": 1, "position": "GK" },
        { "name": "Oleksii Sych", "number": 6, "position": "DF" },
        { "name": "Oleh Ocheretko", "number": 7, "position": "MF" },
        { "name": "Ihor Krasnopir", "number": 9, "position": "FW" },
        { "name": "Volodymyr Saliuk", "number": 13, "position": "DF" },
        { "name": "Vladyslav Veleten", "number": 15, "position": "MF" },
        { "name": "Oleh Fedor", "number": 17, "position": "MF" }
      ]
    }
  }
}
