{
  "competition": {
    "name": "Paris 2024 Olympic Games - Women's Football",
    "season": "2024",
    "round": "Group C"
  },
  "venue": {
    "name": "La Beaujoire Stadium",
    "city": "Nantes"
  },
  "kickoff": "2024-07-25T17:00:00+02:00",
  "status": "FT",
  "teams": {
    "home": "Spain",
    "away": "Japan"
  },
  "score": {
    "home": 2,
    "away": 1,
    "halfTime": {
      "home": 1,
      "away": 1
    }
  },
  "scorers": [
    {
      "team": "Japan",
      "player": "Aoba Fujino",
      "minute": 13,
      "type": "free_kick"
    },
    {
      "team": "Spain",
      "player": "Aitana Bonmati",
      "minute": 22,
      "assist": "Athenea del Castillo",
      "type": "open_play"
    },
    {
      "team": "Spain",
      "player": "Mariona Caldentey",
      "minute": 74,
      "assist": "Aitana Bonmati",
      "type": "open_play"
    }
  ],
  "lineups": {
    "home": {
      "team": "Spain",
      "formation": "4-1-2-3",
      "coach": "Montse Tome",
      "startingXI": [
        { "name": "Cata Coll", "number": 13, "position": "GK" },
        { "name": "Ona Batlle", "number": 2, "position": "DF" },
        { "name": "Irene Paredes", "number": 4, "position": "DF" },
        { "name": "Aitana Bonmati", "number": 6, "position": "MF" },
        { "name": "Athenea del Castillo", "number": 7, "position": "FW" },
        { "name": "Mariona Caldentey", "number": 8, "position": "FW" },
        { "name": "Salma Paralluelo", "number": 9, "position": "FW" },
        { "name": "Alexia Putellas", "number": 11, "position": "MF" },
        { "name": "Patri Guijarro", "number": 12, "position": "MF" },
        { "name": "Laia Aleixandri", "number": 14, "position": "DF" },
        { "name": "Olga Carmona", "number": 18, "position": "DF" }
      ],
      "bench": [
        { "name": "Misa Rodriguez", "number": 1, "position": "GK" },
        { "name": "Teresa Abelleira", "number": 3, "position": "MF" },
        { "name": "Oihane Hernandez", "number": 5, "position": "DF" },
        { "name": "Jennifer Hermoso", "number": 10, "position": "FW" },
        { "name": "Eva Navarro", "number": 15, "position": "FW" },
        { "name": "Laia Codina", "number": 16, "position": "DF" },
        { "name": "Lucia Garcia", "number": 17, "position": "FW" }
      ]
    },
    "away": {
      "team": "Japan",
      "formation": "3-4-3",
      "coach": "Futoshi Ikeda",
      "startingXI": [
        { "name": "Ayaka Yamashita", "number": 1, "position": "GK" },
        { "name": "Risa Shimizu", "number": 2, "position": "DF" },
        { "name": "Moeka Minami", "number": 3, "position": "DF" },
        { "name": "Saki Kumagai", "number": 4, "position": "DF" },
        { "name": "Toko Koga", "number": 6, "position": "DF" },
        { "name": "Hinata Miyazawa", "number": 7, "position": "MF" },
        { "name": "Kiko Seike", "number": 8, "position": "MF" },
        { "name": "Fuka Nagano", "number": 10, "position": "MF" },
        { "name": "Mina Tanaka", "number": 11, "position": "FW" },
        { "name": "Yui Hasegawa", "number": 14, "position": "MF" },
        { "name": "Aoba Fujino", "number": 15, "position": "MF" }
      ],
      "bench": [
        { "name": "Chika Hirao", "number": 18, "position": "GK" },
        { "name": "Hana Takahashi", "number": 5, "position": "DF" },
        { "name": "Riko Ueki", "number": 9, "position": "FW" },
        { "name": "Momoko Tanikawa", "number": 12, "position": "MF" },
        { "name": "Maika Hamano", "number": 17, "position": "FW" },
        { "name": "Remina Chiba", "number": 19, "position": "FW" },
        { "name": "Miyabi Moriya", "number": 20, "position": "DF" }
      ]
    }
  }
}
