{
  "competition": {
    "name": "Paris 2024 Olympic Games - Men's Football",
    "season": "2024",
    "round": "Group C"
  },
  "venue": {
    "name": "Bordeaux Stadium",
    "city": "Bordeaux"
  },
  "kickoff": "2024-07-27T15:00:00+02:00",
  "status": "FT",
  "teams": {
    "home": "Dominican Republic",
    "away": "Spain"
  },
  "score": {
    "home": 1,
    "away": 3,
    "halfTime": {
      "home": 1,
      "away": 1
    }
  },
  "scorers": [
    {
      "team": "Spain",
      "player": "Fermin Lopez",
      "minute": 24,
      "type": "open_play"
    },
    {
      "team": "Dominican Republic",
      "player": "Angel Montes de Oca",
      "minute": 38,
      "assist": "Edison Azcona",
      "type": "open_play"
    },
    {
      "team": "Spain",
      "player": "Alex Baena",
      "minute": 55,
      "assist": "Aimar Oroz",
      "type": "open_play"
    },
    {
      "team": "Spain",
      "player": "Miguel Gutierrez",
      "minute": 70,
      "type": "open_play"
    }
  ],
  "lineups": {
    "home": {
      "team": "Dominican Republic",
      "formation": "3-5-2",
      "coach": "Ibai Gomez",
      "startingXI": [
        { "name": "Enrique Boesl", "number": 13, "position": "GK" },
        { "name": "Francisco Reyes", "number": 2, "position": "DF" },
        { "name": "Edgar Pujol", "number": 4, "position": "DF" },
        { "name": "Luiyi de Lucas", "number": 5, "position": "DF" },
        { "name": "Heinz Morschel", "number": 6, "position": "MF" },
        { "name": "Angel Montes de Oca", "number": 8, "position": "MF" },
        { "name": "Edison Azcona", "number": 10, "position": "MF" },
        { "name": "Joao Urbaez", "number": 12, "position": "DF" },
        { "name": "Omar de la Cruz", "number": 14, "position": "MF" },
        { "name": "Nelson Lemaire", "number": 16, "position": "DF" },
        { "name": "Nowend Lorenzo", "number": 18, "position": "FW" }
      ],
      "bench": [
        { "name": "Xavier Valdez", "number": 1, "position": "GK" },
        { "name": "Josue Baez", "number": 3, "position": "MF" },
        { "name": "Oscar Urena", "number": 7, "position": "FW" },
        { "name": "Rafael Nunez", "number": 9, "position": "FW" },
        { "name": "Peter Gonzalez", "number": 11, "position": "FW" },
        { "name": "Jose de Leon", "number": 17, "position": "FW" },
        { "name": "Thomas Jungbauer", "number": 20, "position": "DF" }
      ]
    },
    "away": {
      "team": "Spain",
      "formation": "4-1-2-3",
      "coach": "Santi Denia",
      "startingXI": [
        { "name": "Arnau Tenas", "number": 1, "position": "GK" },
        { "name": "Juan Miranda", "number": 3, "position": "DF" },
        { "name": "Eric Garcia", "number": 4, "position": "DF" },
        { "name": "Pau Cubarsi", "number": 5, "position": "DF" },
        { "name": "Pablo Barrios", "number": 6, "position": "MF" },
        { "name": "Abel Ruiz", "number": 9, "position": "FW" },
        { "name": "Alex Baena", "number": 10, "position": "MF" },
        { "name": "Fermin Lopez", "number": 11, "position": "MF" },
        { "name": "Aimar Oroz", "number": 14, "position": "MF" },
        { "name": "Sergio Gomez", "number": 17, "position": "DF" },
        { "name": "Juanlu Sanchez", "number": 20, "position": "DF" }
      ],
      "bench": [
        { "name": "Joan Garcia", "number": 13, "position": "GK" },
        { "name": "Diego Lopez", "number": 7, "position": "FW" },
        { "name": "Benat Turrientes", "number": 8, "position": "MF" },
        { "name": "Jon Pacheco", "number": 12, "position": "DF" },
        { "name": "Miguel Gutierrez", "number": 15, "position": "DF" },
        { "name": "Adrian Bernabe", "number": 16, "position": "MF" },
        { "name": "Samu Omorodion", "number": 18, "position": "FW" }
      ]
    }
  }
}
