{
  "competition": {
    "name": "Paris 2024 Olympic Games - Women's Football",
    "season": "2024",
    "round": "Quarter-final"
  },
  "venue": {
    "name": "Parc des Princes",
    "city": "Paris"
  },
  "kickoff": "2024-08-03T15:00:00+02:00",
  "status": "AET",
  "teams": {
    "home": "United States",
    "away": "Japan"
  },
  "score": {
    "home": 1,
    "away": 0,
    "halfTime": {
      "home": 0,
      "away": 0
    }
  },
  "scorers": [
    {
      "team": "United States",
      "player": "Trinity Rodman",
      "minute": 105,
      "assist": "Crystal Dunn",
      "type": "open_play"
    }
  ],
  "lineups": {
    "home": {
      "team": "United States",
      "formation": "4-1-2-3",
      "coach": "Emma Hayes",
      "startingXI": [
        { "name": "Alyssa Naeher", "number": 1, "position": "GK" },
        { "name": "Emily Fox", "number": 2, "position": "DF" },
        { "name": "Korbin Albert", "number": 3, "position": "MF" },
        { "name": "Naomi Girma", "number": 4, "position": "DF" },
        { "name": "Trinity Rodman", "number": 5, "position": "FW" },
        { "name": "Crystal Dunn", "number": 7, "position": "FW" },
        { "name": "Mallory Swanson", "number": 9, "position": "FW" },
        { "name": "Lindsey Horan", "number": 10, "position": "MF" },
        { "name": "Sophia Smith", "number": 11, "position": "FW" },
        { "name": "Emily Sonnett", "number": 14, "position": "MF" },
        { "name": "Rose Lavelle", "number": 16, "position": "MF" }
      ],
      "bench": [
        { "name": "Casey Murphy", "number": 18, "position": "GK" },
        { "name": "Casey Krueger", "number": 6, "position": "DF" },
        { "name": "Lynn Williams", "number": 8, "position": "FW" },
        { "name": "Jenna Nighswonger", "number": 13, "position": "DF" },
        { "name": "Jaedyn Shaw", "number": 15, "position": "FW" },
        { "name": "Emily Sams", "number": 21, "position": "DF" },
        { "name": "Samantha Coffey", "number": 17, "position": "MF" }
      ]
    },
    "away": {
      "team": "Japan",
      "formation": "3-4-3",
      "coach": "Futoshi Ikeda",
      "startingXI": [
        { "name": "Ayaka Yamashita", "number": 1, "position": "GK" },
        { "name": "Moeka Minami", "number": 3, "position": "DF" },
        { "name": "Saki Kumagai", "number": 4, "position": "DF" },
        { "name": "Toko Koga", "number": 6, "position": "DF" },
        { "name": "Kiko Seike", "number": 8, "position": "MF" },
        { "name": "Fuka Nagano", "number": 10, "position": "MF" },
        { "name": "Mina Tanaka", "number": 11, "position": "FW" },
        { "name": "Hikaru Kitagawa", "number": 13, "position": "DF" },
        { "name": "Yui Hasegawa", "number": 14, "position": "MF" },
        { "name": "Aoba Fujino", "number": 15, "position": "MF" },
        { "name": "Miyabi Moriya", "number": 20, "position": "DF" }
      ],
      "bench": [
        { "name": "Shu Ohba", "number": 22, "position": "GK" },
        { "name": "Hana Takahashi", "number": 5, "position": "DF" },
        { "name": "Hinata Miyazawa", "number": 7, "position": "MF" },
        { "name": "Riko Ueki", "number": 9, "position": "FW" },
        { "name": "Honoka Hayashi", "number": 16, "position": "MF" },
        { "name": "Maika Hamano", "number": 17, "position": "FW" },
        { "name": "Remina Chiba", "number": 19, "position": "FW" }
      ]
    }
  }
}
