{
  "competition": {
    "name": "Paris 2024 Olympic Games - Women's Football",
    "season": "2024",
    "round": "Quarter-final"
  },
  "venue": {
    "name": "Lyon Stadium",
    "city": "Lyon"
  },
  "kickoff": "2024-08-03T17:00:00+02:00",
  "status": "PEN",
  "teams": {
    "home": "Spain",
    "away": "Colombia"
  },
  "score": {
    "home": 2,
    "away": 2,
    "halfTime": {
      "home": 0,
      "away": 1
    }
  },
  "scorers": [
    {
      "team": "Colombia",
      "player": "Mayra Ramirez",
      "minute": 12,
      "assist": "Leicy Santos",
      "type": "open_play"
    },
    {
      "team": "Colombia",
      "player": "Leicy Santos",
      "minute": 52,
      "type": "open_play"
    },
    {
      "team": "Spain",
      "player": "Jennifer Hermoso",
      "minute": 79,
      "assist": "Salma Paralluelo",
      "type": "open_play"
    },
    {
      "team": "Spain",
      "player": "Irene Paredes",
      "minute": 97,
      "assist": "Salma Paralluelo",
      "type": "open_play"
    }
  ],
  "lineups": {
    "home": {
      "team": "Spain",
      "formation": "4-1-2-3",
      "coach": "Montse Tome",
      "startingXI": [
        { "name": "Cata Coll", "number": 13, "position": "GK" },
        { "name": "Ona Batlle", "number": 2, "position": "DF" },
        { "name": "Irene Paredes", "number": 4, "position": "DF" },
        { "name": "Aitana Bonmati", "number": 6, "position": "MF" },
        { "name": "Athenea del Castillo", "number": 7, "position": "FW" },
        { "name": "Mariona Caldentey", "number": 8, "position": "FW" },
        { "name": "Salma Paralluelo", "number": 9, "position": "FW" },
        { "name": "Alexia Putellas", "number": 11, "position": "MF" },
        { "name": "Patri Guijarro", "number": 12, "position": "MF" },
        { "name": "Laia Aleixandri", "number": 14, "position": "DF" },
        { "name": "Olga Carmona", "number": 18, "position": "DF" }
      ],
      "bench": [
        { "name": "Misa Rodriguez", "number": 1, "position": "GK" },
        { "name": "Teresa Abelleira", "number": 3, "position": "MF" },
        { "name": "Jennifer Hermoso", "number": 10, "position": "FW" },
        { "name": "Eva Navarro", "number": 15, "position": "FW" },
        { "name": "Laia Codina", "number": 16, "position": "DF" },
        { "name": "Lucia Garcia", "number": 17, "position": "FW" },
        { "name": "Alba Redondo", "number": 21, "position": "FW" }
      ]
    },
    "away": {
      "team": "Colombia",
      "formation": "4-2-3-1",
      "coach": "Angelo Marsiglia",
      "startingXI": [
        { "name": "Katherine Tapia", "number": 12, "position": "GK" },
        { "name": "Manuela Vanegas", "number": 2, "position": "DF" },
        { "name": "Daniela Arias", "number": 3, "position": "DF" },
        { "name": "Manuela Pavi", "number": 7, "position": "FW" },
        { "name": "Marcela Restrepo", "number": 8, "position": "MF" },
        { "name": "Mayra Ramirez", "number": 9, "position": "FW" },
        { "name": "Leicy Santos", "number": 10, "position": "MF" },
        { "name": "Catalina Usme", "number": 11, "position": "FW" },
        { "name": "Jorelyn Carabali", "number": 16, "position": "DF" },
        { "name": "Carolina Arias", "number": 17, "position": "DF" },
        { "name": "Linda Caicedo", "number": 18, "position": "FW" }
      ],
      "bench": [
        { "name": "Sandra Sepulveda", "number": 22, "position": "GK" },
        { "name": "Daniela Caracas", "number": 4, "position": "DF" },
        { "name": "Yirleidys Quejada Minota", "number": 5, "position": "DF" },
        { "name": "Daniela Montoya", "number": 6, "position": "MF" },
        { "name": "Ilana Izquierdo", "number": 13, "position": "MF" },
        { "name": "Angela Baron", "number": 14, "position": "DF" },
        { "name": "Liana Salazar", "number": 15, "position": "MF" }
      ]
    }
  }
}
